{
  "$schema": "https://json-schema.org/draft/2020-12/schema",
  "$id": "https://github.com/canswang/hx/schema/hx-2.schema.json",
  "title": "hx graph (schema hx/2)",
  "description": "Function-scoped structure graph produced by `hx extract`. Compatibility policy: within major 2 fields may be ADDED (readers must ignore unknown fields); removing or re-typing a field, or changing an id rule, bumps the major. hx/1 files are upgraded in memory by hx/graphio.py (lossless renames only; module-scoped SV type ids and anonymous SV type ids need `hx migrate`, which re-extracts). Units: C/C++ `offset`/`size`/`align` are BYTES and `bit_offset`/`bit_width` describe bitfields; SystemVerilog `size`, `offset` (= bit offset, MSB first) and `bit_width` are BITS. Values: an integer whose magnitude is below 2**53 is a JSON number; wider values are lossless strings in canonical hex (`<width>'<s>h<hex>` when the width is known, `0x<hex>`/`-0x<hex>` otherwise); x/z literals are bit patterns `<width>'b<0/1/x/z…>` (see hx/values.py). Precision per node: `exact` = compiler/elaborator derived (libclang, verilator); `lsp` = from a language server.",
  "type": "object",
  "required": [
    "schema",
    "generated",
    "root",
    "lang",
    "entry",
    "nodes",
    "types",
    "globals",
    "edges",
    "unresolved"
  ],
  "properties": {
    "schema": {
      "const": "hx/2"
    },
    "generated": {
      "type": "string",
      "description": "ISO-8601 UTC timestamp"
    },
    "root": {
      "type": "string",
      "description": "absolute project root; every relpath in ids/locs is relative to it"
    },
    "lang": {
      "type": "string",
      "examples": [
        "c",
        "cpp",
        "sv",
        "rs",
        "py",
        "go"
      ],
      "description": "frontend language tag; new frontends add tags without a major bump"
    },
    "entry": {
      "$ref": "#/$defs/id"
    },
    "meta": {
      "type": "object",
      "description": "free-form: extract_args, options, index stats (warnings, warnings_by_tag, variants), notes, truncated, migration (when upgraded from hx/1)"
    },
    "nodes": {
      "type": "object",
      "additionalProperties": {
        "$ref": "#/$defs/node"
      }
    },
    "types": {
      "type": "object",
      "additionalProperties": {
        "$ref": "#/$defs/typedef"
      }
    },
    "globals": {
      "type": "object",
      "additionalProperties": {
        "$ref": "#/$defs/global"
      }
    },
    "edges": {
      "type": "array",
      "items": {
        "$ref": "#/$defs/edge"
      }
    },
    "unresolved": {
      "type": "array",
      "items": {
        "$ref": "#/$defs/unresolved"
      }
    }
  },
  "$defs": {
    "id": {
      "type": "string",
      "pattern": "^[a-z]+:[^\\n]+::.+$",
      "description": "<lang>:<relpath>::<qualname>. C++ functions carry their parameter type list (cpp:src/bus.cpp::hw::Bus::write(uint32_t, uint32_t)); a #<8hex> suffix only on a residual collision. Records: '<kind> <name>' (struct dma_chan); anonymous C records: '<kind> <parent>.<member>'. SystemVerilog: package-scoped types keep '<kind> <pkg>::<name>'; a type declared inside a module is identified by its layout, '<kind> <module>.<name>@<8hex layout fingerprint>'; anonymous SV types are named by their first declaring context ('<kind> <module>.<port>' / '<kind> <parent>.<field>', fallback 'anon#<hash>'); generate-array paths use source spelling ('gen_lane[0].u_x', never Verilator's __BRA__0__KET__)."
    },
    "loc": {
      "type": "object",
      "required": [
        "file",
        "line"
      ],
      "properties": {
        "file": {
          "type": "string"
        },
        "line": {
          "type": "integer",
          "minimum": 0
        },
        "end_line": {
          "type": [
            "integer",
            "null"
          ],
          "description": "last line of the definition (SV: the endmodule/endfunction/endtask line)"
        },
        "col": {
          "type": [
            "integer",
            "null"
          ]
        }
      }
    },
    "typeuse": {
      "type": "object",
      "required": [
        "type"
      ],
      "properties": {
        "type": {
          "type": "string"
        },
        "type_ref": {
          "type": [
            "string",
            "null"
          ]
        }
      }
    },
    "param": {
      "type": "object",
      "required": [
        "name",
        "type",
        "dir",
        "dir_source"
      ],
      "properties": {
        "name": {
          "type": "string"
        },
        "type": {
          "type": "string"
        },
        "type_ref": {
          "type": [
            "string",
            "null"
          ]
        },
        "dir": {
          "enum": [
            "in",
            "out",
            "inout"
          ]
        },
        "dir_source": {
          "enum": [
            "explicit",
            "heuristic",
            "user"
          ]
        }
      }
    },
    "field": {
      "type": "object",
      "required": [
        "name",
        "type"
      ],
      "properties": {
        "name": {
          "type": "string"
        },
        "type": {
          "type": "string"
        },
        "type_ref": {
          "type": [
            "string",
            "null"
          ]
        },
        "offset": {
          "type": [
            "integer",
            "null"
          ]
        },
        "size": {
          "type": [
            "integer",
            "null"
          ]
        },
        "bit_offset": {
          "type": [
            "integer",
            "null"
          ]
        },
        "bit_width": {
          "type": [
            "integer",
            "null"
          ]
        }
      }
    },
    "node": {
      "type": "object",
      "required": [
        "id",
        "kind",
        "name",
        "qualname",
        "lang",
        "loc",
        "signature",
        "depth",
        "precision",
        "params",
        "globals",
        "calls"
      ],
      "properties": {
        "id": {
          "$ref": "#/$defs/id"
        },
        "kind": {
          "enum": [
            "function",
            "method",
            "module",
            "instance",
            "task"
          ]
        },
        "name": {
          "type": "string"
        },
        "qualname": {
          "type": "string"
        },
        "lang": {
          "type": "string"
        },
        "loc": {
          "$ref": "#/$defs/loc"
        },
        "signature": {
          "type": "string"
        },
        "storage": {
          "type": [
            "string",
            "null"
          ]
        },
        "depth": {
          "type": "integer",
          "description": "min BFS distance from the entry; negative on the caller side"
        },
        "body_hash": {
          "type": [
            "string",
            "null"
          ],
          "pattern": "^sha1:[0-9a-f]{40}$",
          "description": "token hash of the body: formatting and comments do not change it; literals, operator adjacency and Python indentation do"
        },
        "precision": {
          "enum": [
            "exact",
            "lsp",
            "syntax"
          ]
        },
        "returns": {
          "anyOf": [
            {
              "$ref": "#/$defs/typeuse"
            },
            {
              "type": "null"
            }
          ]
        },
        "params": {
          "type": "array",
          "items": {
            "$ref": "#/$defs/param"
          }
        },
        "globals": {
          "type": "object",
          "properties": {
            "reads": {
              "type": "array",
              "items": {
                "type": "string"
              }
            },
            "writes": {
              "type": "array",
              "items": {
                "type": "string"
              }
            }
          }
        },
        "calls": {
          "type": "array",
          "items": {
            "type": "string"
          }
        },
        "attrs": {
          "type": "object",
          "description": "frontend extras; SV: module, specialization, parameters {name: number|canonical string}, signals [{name,type}]; Rust: module path"
        },
        "runtime": {
          "description": "reserved (Phase 5)"
        }
      }
    },
    "typedef": {
      "type": "object",
      "required": [
        "id",
        "kind",
        "name",
        "lang"
      ],
      "properties": {
        "id": {
          "type": "string"
        },
        "kind": {
          "type": "string"
        },
        "name": {
          "type": "string"
        },
        "lang": {
          "type": "string"
        },
        "loc": {
          "anyOf": [
            {
              "$ref": "#/$defs/loc"
            },
            {
              "type": "null"
            }
          ]
        },
        "size": {
          "type": [
            "integer",
            "null"
          ]
        },
        "align": {
          "type": [
            "integer",
            "null"
          ]
        },
        "fields": {
          "type": "array",
          "items": {
            "$ref": "#/$defs/field"
          }
        },
        "enumerators": {
          "type": "array",
          "items": {
            "type": "object",
            "required": [
              "name",
              "value"
            ],
            "properties": {
              "name": {
                "type": "string"
              },
              "value": {
                "type": [
                  "integer",
                  "string",
                  "null"
                ],
                "description": "JSON number below 2**53, else canonical hex string; x/z enumerators keep their bit pattern"
              }
            }
          }
        },
        "underlying": {
          "type": [
            "string",
            "null"
          ]
        },
        "underlying_ref": {
          "type": [
            "string",
            "null"
          ]
        },
        "anonymous": {
          "type": "boolean"
        },
        "system": {
          "type": "boolean"
        },
        "used_by": {
          "type": "array",
          "items": {
            "type": "string"
          }
        }
      }
    },
    "global": {
      "type": "object",
      "required": [
        "id",
        "name",
        "type",
        "lang"
      ],
      "properties": {
        "id": {
          "type": "string"
        },
        "name": {
          "type": "string"
        },
        "type": {
          "type": "string"
        },
        "lang": {
          "type": "string"
        },
        "type_ref": {
          "type": [
            "string",
            "null"
          ]
        },
        "loc": {
          "anyOf": [
            {
              "$ref": "#/$defs/loc"
            },
            {
              "type": "null"
            }
          ]
        },
        "storage": {
          "type": [
            "string",
            "null"
          ]
        },
        "scope": {
          "type": "string"
        }
      }
    },
    "edge": {
      "type": "object",
      "required": [
        "from",
        "kind"
      ],
      "properties": {
        "from": {
          "type": "string"
        },
        "to": {
          "type": [
            "string",
            "null"
          ],
          "description": "null for calls through function pointers"
        },
        "kind": {
          "enum": [
            "call",
            "ref",
            "fnptr",
            "macro",
            "instance"
          ]
        },
        "loc": {
          "anyOf": [
            {
              "$ref": "#/$defs/loc"
            },
            {
              "type": "null"
            }
          ]
        },
        "args": {
          "type": "array",
          "items": {
            "type": "string"
          }
        },
        "name": {
          "type": [
            "string",
            "null"
          ]
        },
        "macro": {
          "type": [
            "string",
            "null"
          ]
        },
        "ptr_type": {
          "type": [
            "string",
            "null"
          ]
        }
      }
    },
    "unresolved": {
      "type": "object",
      "required": [
        "name",
        "from",
        "reason"
      ],
      "properties": {
        "name": {
          "type": "string"
        },
        "from": {
          "type": "string",
          "description": "always a node id present in `nodes`"
        },
        "reason": {
          "type": "string"
        },
        "loc": {
          "anyOf": [
            {
              "$ref": "#/$defs/loc"
            },
            {
              "type": "null"
            }
          ]
        },
        "id": {
          "type": [
            "string",
            "null"
          ]
        }
      }
    }
  }
}
