{
  "schema": "hx/2",
  "generated": "2026-10-10T08:07:29+00:00",
  "root": "/home/canswang/apragma",
  "lang": "py",
  "entry": "py:src/apragma/backends/build_orchestrator.py::BuildOrchestrator.build",
  "meta": {
    "truncated": false,
    "options": {
      "depth": 3,
      "type_depth": 2,
      "include_callers": false,
      "include_system": false,
      "exclude": [],
      "max_nodes": 500
    },
    "entry_arg": "src/apragma/backends/build_orchestrator.py:BuildOrchestrator.build",
    "server": "/home/canswang/hierX/.venv/bin/python -m pyright.langserver --stdio",
    "extract_args": {
      "entry": "src/apragma/backends/build_orchestrator.py:BuildOrchestrator.build",
      "root": "/home/canswang/apragma",
      "compile_commands": null,
      "depth": 3,
      "type_depth": 2,
      "include_callers": false,
      "include_system": false,
      "exclude": [],
      "max_nodes": 500,
      "extra_args": [],
      "resource_dir": null,
      "lang": "python",
      "sv_files": [],
      "filelist": null,
      "top": null,
      "verilator": "verilator",
      "lsp_cmd": [
        "/home/canswang/hierX/.venv/bin/python",
        "-m",
        "pyright.langserver",
        "--stdio"
      ],
      "lsp_timeout": 120
    },
    "index": {
      "server": "/home/canswang/hierX/.venv/bin/python -m pyright.langserver --stdio",
      "ready_seconds": 1.66,
      "tus": 0,
      "parsed": 0,
      "cached": 0,
      "tu_errors": 0,
      "diagnostics": 0,
      "index_seconds": 1.66
    }
  },
  "nodes": {
    "py:src/apragma/backends/build_orchestrator.py::BuildOrchestrator.build": {
      "id": "py:src/apragma/backends/build_orchestrator.py::BuildOrchestrator.build",
      "kind": "method",
      "name": "build",
      "qualname": "BuildOrchestrator.build",
      "lang": "py",
      "loc": {
        "file": "src/apragma/backends/build_orchestrator.py",
        "line": 245,
        "end_line": 256,
        "col": 3
      },
      "signature": "(method) def build(s: Self@BuildOrchestrator) -> None",
      "storage": null,
      "depth": 0,
      "body_hash": "sha1:1f8fbcaf33c82174d020a8ccc57b84075e9580ad",
      "precision": "lsp",
      "returns": {
        "type": "None",
        "type_ref": null
      },
      "params": [
        {
          "name": "s",
          "type": "Self@BuildOrchestrator",
          "type_ref": null,
          "dir": "in",
          "dir_source": "explicit"
        }
      ],
      "globals": {
        "reads": [],
        "writes": []
      },
      "calls": [
        "py:src/apragma/backends/build_orchestrator.py::BuildOrchestrator._build"
      ],
      "attrs": {},
      "runtime": null
    },
    "py:src/apragma/backends/build_orchestrator.py::BuildOrchestrator._build": {
      "id": "py:src/apragma/backends/build_orchestrator.py::BuildOrchestrator._build",
      "kind": "method",
      "name": "_build",
      "qualname": "BuildOrchestrator._build",
      "lang": "py",
      "loc": {
        "file": "src/apragma/backends/build_orchestrator.py",
        "line": 258,
        "end_line": 512,
        "col": 3
      },
      "signature": "(method) def _build(s: Self@BuildOrchestrator) -> None",
      "storage": null,
      "depth": 1,
      "body_hash": "sha1:4343fdbb0e1ac4655110201c1752a50ddbe4657a",
      "precision": "lsp",
      "returns": {
        "type": "None",
        "type_ref": null
      },
      "params": [
        {
          "name": "s",
          "type": "Self@BuildOrchestrator",
          "type_ref": null,
          "dir": "in",
          "dir_source": "explicit"
        }
      ],
      "globals": {
        "reads": [],
        "writes": []
      },
      "calls": [
        "py:src/apragma/backends/build_orchestrator.py::BuildOrchestrator.setup",
        "py:src/apragma/backends/build_orchestrator.py::BuildOrchestrator._node_banner_cmd"
      ],
      "attrs": {},
      "runtime": null
    },
    "py:src/apragma/backends/build_orchestrator.py::BuildOrchestrator.setup": {
      "id": "py:src/apragma/backends/build_orchestrator.py::BuildOrchestrator.setup",
      "kind": "method",
      "name": "setup",
      "qualname": "BuildOrchestrator.setup",
      "lang": "py",
      "loc": {
        "file": "src/apragma/backends/build_orchestrator.py",
        "line": 193,
        "end_line": 239,
        "col": 3
      },
      "signature": "(method) def setup(s: Self@BuildOrchestrator) -> None",
      "storage": null,
      "depth": 2,
      "body_hash": "sha1:c43c555a72e86b862e51ee85471485507be0a243",
      "precision": "lsp",
      "returns": {
        "type": "None",
        "type_ref": null
      },
      "params": [
        {
          "name": "s",
          "type": "Self@BuildOrchestrator",
          "type_ref": null,
          "dir": "in",
          "dir_source": "explicit"
        }
      ],
      "globals": {
        "reads": [],
        "writes": []
      },
      "calls": [
        "py:src/apragma/backends/build_orchestrator.py::BuildOrchestrator.set_unique_build_ids",
        "py:src/apragma/backends/build_orchestrator.py::BuildOrchestrator.dump_yamls",
        "py:src/apragma/backends/build_orchestrator.py::BuildOrchestrator.dump_commands",
        "py:src/apragma/backends/build_orchestrator.py::BuildOrchestrator.dump_debug_commands",
        "py:src/apragma/backends/build_orchestrator.py::_dump_assertion_check_scripts",
        "py:src/apragma/backends/build_orchestrator.py::BuildOrchestrator.dump_graphviz"
      ],
      "attrs": {},
      "runtime": null
    },
    "py:src/apragma/backends/build_orchestrator.py::BuildOrchestrator._node_banner_cmd": {
      "id": "py:src/apragma/backends/build_orchestrator.py::BuildOrchestrator._node_banner_cmd",
      "kind": "method",
      "name": "_node_banner_cmd",
      "qualname": "BuildOrchestrator._node_banner_cmd",
      "lang": "py",
      "loc": {
        "file": "src/apragma/backends/build_orchestrator.py",
        "line": 241,
        "end_line": 243,
        "col": 3
      },
      "signature": "(method) def _node_banner_cmd( s: Self@BuildOrchestrator, node_name: Unknown ) -> str",
      "storage": null,
      "depth": 2,
      "body_hash": "sha1:2616fb869cba48cc94825114382eb57b211467fd",
      "precision": "lsp",
      "returns": {
        "type": "str",
        "type_ref": null
      },
      "params": [
        {
          "name": "s",
          "type": "Self@BuildOrchestrator",
          "type_ref": null,
          "dir": "in",
          "dir_source": "explicit"
        },
        {
          "name": "node_name",
          "type": "Unknown",
          "type_ref": null,
          "dir": "in",
          "dir_source": "explicit"
        }
      ],
      "globals": {
        "reads": [],
        "writes": []
      },
      "calls": [
        "py:src/apragma/backends/cli_commands.py::helper_command"
      ],
      "attrs": {},
      "runtime": null
    },
    "py:src/apragma/backends/build_orchestrator.py::BuildOrchestrator.set_unique_build_ids": {
      "id": "py:src/apragma/backends/build_orchestrator.py::BuildOrchestrator.set_unique_build_ids",
      "kind": "method",
      "name": "set_unique_build_ids",
      "qualname": "BuildOrchestrator.set_unique_build_ids",
      "lang": "py",
      "loc": {
        "file": "src/apragma/backends/build_orchestrator.py",
        "line": 157,
        "end_line": 178,
        "col": 3
      },
      "signature": "(method) def set_unique_build_ids(s: Self@BuildOrchestrator) -> None",
      "storage": null,
      "depth": 3,
      "body_hash": "sha1:8fc2aaf654d9533781e6deb672dc5ab890d808cd",
      "precision": "lsp",
      "returns": {
        "type": "None",
        "type_ref": null
      },
      "params": [
        {
          "name": "s",
          "type": "Self@BuildOrchestrator",
          "type_ref": null,
          "dir": "in",
          "dir_source": "explicit"
        }
      ],
      "globals": {
        "reads": [],
        "writes": []
      },
      "calls": [],
      "attrs": {},
      "runtime": null
    },
    "py:src/apragma/backends/build_orchestrator.py::BuildOrchestrator.dump_yamls": {
      "id": "py:src/apragma/backends/build_orchestrator.py::BuildOrchestrator.dump_yamls",
      "kind": "method",
      "name": "dump_yamls",
      "qualname": "BuildOrchestrator.dump_yamls",
      "lang": "py",
      "loc": {
        "file": "src/apragma/backends/build_orchestrator.py",
        "line": 57,
        "end_line": 62,
        "col": 3
      },
      "signature": "(method) def dump_yamls( s: Self@BuildOrchestrator, node_name: Unknown, build_dir: Unknown ) -> None",
      "storage": null,
      "depth": 3,
      "body_hash": "sha1:e8d872397d37f413b478641d60c8e911ef3a6311",
      "precision": "lsp",
      "returns": {
        "type": "None",
        "type_ref": null
      },
      "params": [
        {
          "name": "s",
          "type": "Self@BuildOrchestrator",
          "type_ref": null,
          "dir": "in",
          "dir_source": "explicit"
        },
        {
          "name": "node_name",
          "type": "Unknown",
          "type_ref": null,
          "dir": "in",
          "dir_source": "explicit"
        },
        {
          "name": "build_dir",
          "type": "Unknown",
          "type_ref": null,
          "dir": "in",
          "dir_source": "explicit"
        }
      ],
      "globals": {
        "reads": [],
        "writes": []
      },
      "calls": [],
      "attrs": {},
      "runtime": null
    },
    "py:src/apragma/backends/build_orchestrator.py::BuildOrchestrator.dump_commands": {
      "id": "py:src/apragma/backends/build_orchestrator.py::BuildOrchestrator.dump_commands",
      "kind": "method",
      "name": "dump_commands",
      "qualname": "BuildOrchestrator.dump_commands",
      "lang": "py",
      "loc": {
        "file": "src/apragma/backends/build_orchestrator.py",
        "line": 64,
        "end_line": 115,
        "col": 3
      },